{"$schema":"https://litheview.dev/schema/display-surface.schema.json","schemaVersion":1,"id":"litheview.menu.h750.surface","displayName":"H750 480x272 RGB565","compatibilityFamily":"litheview.menu.h750.display-family","shape":"rectangle","physicalSize":{"widthMillimeters":95.04,"heightMillimeters":53.86},"pixelSize":{"width":480,"height":272},"coordinateSystem":{"origin":"topLeft","rotationDegrees":0},"painterSurface":{"format":"rgb565","colorDepthBits":16,"storageBitsPerPixel":16},"nativeDisplay":{"colorModel":"rgb","colorDepthBits":24,"transferUnitBits":24,"transferFormat":"rgb888Parallel"},"safeArea":{"x":0,"y":0,"width":480,"height":272},"inputCapabilities":[],"provenance":{"manufacturer":"Rocktech Displays Limited","model":"RK043FN48H-CT672B","sourceUrl":"https://www.rocktech.com.hk/lcd-product/rk043fn48h-ct672b/","sourceDocument":"Rocktech RK043FN48H-CT672B product specification page","sourceSha256":null,"notes":"Declared by the application developer in VS Code; hardware verification is separate."}}