{
  "$schema": "../../schema/display-surface.schema.json",
  "schemaVersion": 1,
  "id": "litheview.surface.synthetic-red-yellow-staging",
  "displayName": "Synthetic legacy staging test: red-yellow-staging",
  "compatibilityFamily": "litheview.surface-family.synthetic-red-yellow-staging",
  "shape": "rectangle",
  "physicalSize": {
    "widthMillimeters": 51.2,
    "heightMillimeters": 38.4
  },
  "pixelSize": {
    "width": 256,
    "height": 192
  },
  "coordinateSystem": {
    "origin": "topLeft",
    "rotationDegrees": 0
  },
  "painterSurface": {
    "format": "rgb565",
    "colorDepthBits": 16,
    "storageBitsPerPixel": 16
  },
  "nativeDisplay": {
    "colorModel": "redYellowFullPixel",
    "colorDepthBits": 4,
    "transferUnitBits": 8,
    "transferFormat": "packed8"
  },
  "safeArea": {
    "x": 0,
    "y": 0,
    "width": 256,
    "height": 192
  },
  "inputCapabilities": [
    "encoder",
    "pushButton"
  ],
  "provenance": {
    "manufacturer": "LiTheView test fixture",
    "model": "synthetic-red-yellow-staging",
    "sourceUrl": "https://github.com/kg7hf/LiTheView",
    "sourceDocument": "Synthetic software contract for regression tests",
    "sourceSha256": null,
    "notes": "Invented geometry and dimensions. This fixture is not a hardware display or a driver specification."
  }
}
